{
  "$schema": "https://json-schema.org/draft/2020-12/schema",
  "$id": "https://crypto-quant.local/schemas/challenger-replacement-v3-owner-attestation-v1.schema.json",
  "title": "Replacement v3 accountable owner pre-start attestation",
  "type": "object",
  "additionalProperties": false,
  "required": ["$schema","schema_version","attestation_id","attestation_hash","evidence_qualification","attestation_type","signed_at","signer","declaration","declaration_sha256","owner_acknowledgement","previous_plan","v068_foundation","v3_plan","machine_evidence"],
  "properties": {
    "$schema": {"const": "./challenger-replacement-v3-owner-attestation-v1.schema.json"},
    "schema_version": {"const": "1.0.0"},
    "attestation_id": {"type": "string", "pattern": "^challenger_replacement_v3_owner_attestation_[0-9a-f]{64}$"},
    "attestation_hash": {"$ref": "#/$defs/hash"},
    "evidence_qualification": {"const": "REAL_PRE_START_V3_SUPERSESSION_EVIDENCE"},
    "attestation_type": {"const": "ACCOUNTABLE_OWNER_PRE_START_V3_ATTESTATION"},
    "signed_at": {"$ref": "#/$defs/time"},
    "signer": {
      "type": "object",
      "additionalProperties": false,
      "required": ["github_login","os_username","uid"],
      "properties": {
        "github_login": {"const": "cjl308868584-lang"},
        "os_username": {"const": "chenm4"},
        "uid": {"const": 501}
      }
    },
    "declaration": {"const": "I attest that before the bound machine-evidence collection time the replacement-v3 service had never been installed or started, no replacement start receipt or canonical production opportunity event had been created, and no real order had been submitted by this replacement path. I understand this is an accountable governance statement, not a fact that code or an OS snapshot can prove, and that supersession is forbidden after the first v3 start receipt or canonical production opportunity event."},
    "declaration_sha256": {"const": "96118edf26780da889c1431d2363c1afa9f69749f1f550f8e1327248731a2212"},
    "owner_acknowledgement": {"const": "I_SIGN_AND_ACCEPT_ACCOUNTABILITY_FOR_THE_EXACT_V3_DECLARATION"},
    "previous_plan": {"$ref": "#/$defs/previousPlan"},
    "v068_foundation": {"$ref": "#/$defs/foundation"},
    "v3_plan": {"$ref": "#/$defs/planBinding"},
    "machine_evidence": {"$ref": "#/$defs/machineBinding"}
  },
  "$defs": {
    "hash": {"type": "string", "pattern": "^[0-9a-f]{64}$"},
    "time": {"type": "string", "pattern": "^\\d{4}-\\d{2}-\\d{2}T\\d{2}:\\d{2}:\\d{2}\\.\\d{3}Z$"},
    "previousPlan": {
      "type": "object",
      "additionalProperties": false,
      "required": ["release_tag","path","file_sha256","plan_id","plan_hash"],
      "properties": {
        "release_tag": {"const": "v0.64.0"},
        "path": {"const": "artifacts/challenger-replacement/challenger-replacement-plan-v0.64.0.json"},
        "file_sha256": {"const": "5f1774fd912451d79c9efe13401e80f312fee3c707d9faa252933ef3e8810a8f"},
        "plan_id": {"const": "challenger_replacement_plan_65d85d60a534a917f45a1ffa5fc9d3f74d6d24995b900d31b8c73cd26f0bd97b"},
        "plan_hash": {"const": "c9a1e5f74c52fbf23be5a1d27fd23c25f3601ed58133178fc25480391ab65705"}
      }
    },
    "foundation": {
      "type": "object",
      "additionalProperties": false,
      "required": ["release_tag","peeled_commit","package_version","manifest_version","build_input_tree_hash","manifest_hash","manifest_file_sha256"],
      "properties": {
        "release_tag": {"const": "v0.68.0"},
        "peeled_commit": {"const": "1371997d61679609804d58753ae79147d60e1c01"},
        "package_version": {"const": "0.68.0"},
        "manifest_version": {"const": "1.62.0"},
        "build_input_tree_hash": {"const": "0e6bde43eff304bc42cab90895da47296a9c6b8996b0d99a0d1ca4009a71083e"},
        "manifest_hash": {"const": "f4ce2f0a67b04541b850f5841897927e2886a339fecb3f11356ad96b2d7370b5"},
        "manifest_file_sha256": {"const": "d7c70074fef46f28d028cc330a8726755fe999bba5af90af90a24f285df37a79"}
      }
    },
    "planBinding": {
      "type": "object",
      "additionalProperties": false,
      "required": ["path","file_sha256","plan_id","plan_hash"],
      "properties": {
        "path": {"const": "artifacts/challenger-replacement/challenger-replacement-plan-v0.69.0.json"},
        "file_sha256": {"$ref": "#/$defs/hash"},
        "plan_id": {"type": "string", "pattern": "^challenger_replacement_plan_v3_[0-9a-f]{64}$"},
        "plan_hash": {"$ref": "#/$defs/hash"}
      }
    },
    "machineBinding": {
      "type": "object",
      "additionalProperties": false,
      "required": ["path","file_sha256","evidence_id","evidence_hash","git_history_evidence_hash","collected_at"],
      "properties": {
        "path": {"const": "artifacts/challenger-replacement/challenger-replacement-v3-supersession-machine-evidence-v0.69.0.json"},
        "file_sha256": {"$ref": "#/$defs/hash"},
        "evidence_id": {"type": "string", "pattern": "^challenger_replacement_v3_machine_evidence_[0-9a-f]{64}$"},
        "evidence_hash": {"$ref": "#/$defs/hash"},
        "git_history_evidence_hash": {"$ref": "#/$defs/hash"},
        "collected_at": {"$ref": "#/$defs/time"}
      }
    }
  }
}
